question,reponse,tags
Quelles sont les plus belles plages du Cap Bon ?,"Les incontournables : **Plage de Mansoura** (Kélibia) — sable blanc, eau turquoise, idéale familles. **Ghar el Kebir** (El Haouaria) — calme, entrée facile. **Plage de Korba** — peu touristique, parfaite enfants. **Plage de Hammamet** — la plus équipée du Cap Bon.",plage,plages,baignade,mer,sable,belle,belles,nager
Quelle est la meilleure plage pour les enfants ?,"Pour les enfants : **Mansoura** (Kélibia) eau peu profonde et sable fin, **Korba** pour le calme. Éviter les plages rocheuses du nord. Hammamet centre très sécurisée avec surveillance en saison.",enfants,enfant,famille,familles,bébé,jeunes
Où se trouve la plage de Mansoura ?,"Plage de Mansoura à **Kélibia**, 5 km au nord de la ville. 3 km de sable blanc, eau cristalline, infrastructures complètes. Coordonnées GPS : 36.89°N, 11.09°E.",mansoura,kelibia,kélibia,trouver,localiser
Quelles conditions pour plonger à El Haouaria ?,"**Grottes marines** (5-15m) : niveau 1, murènes, poulpes, girelles, lampe indispensable. **Tombants nord** (20-40m) : niveau 2, gorgones rouges, mérous. **Herbiers posidonie** (5-15m) : tortues, daurades. Meilleur créneau : **tôt le matin (8h-11h)**.",plongée,plonger,plongee,haouaria,el haouaria,grottes,sous-marin
Où pratiquer l'apnée au Cap Bon ?,"L'apnée est idéale à **El Haouaria** : grottes marines (5-15m, débutant), côte nord rocheuse (10-30m, avancé). Règles absolues : jamais seul, binôme obligatoire, hyperventilation interdite. Visibilité > 5m, vent < Beaufort 3.",apnée,apnee,apneiste,freediving
Comment aller au Cap Bon depuis Tunis ?,"**En voiture** : Hammamet (60km, 1h), Kélibia (110km, 1h30), El Haouaria (110km, 1h45). **En louage** : depuis Bab Alioua (Tunis) — économique, toute la journée. **En bus** : SNTRI vers Nabeul et Kélibia.",transport,aller,partir,louage,bus,voiture,trajet,distance,comment aller,depuis tunis
Distance Tunis à El Haouaria ?,"El Haouaria : **110 km** de Tunis, environ **1h45** en voiture via Nabeul et Kélibia. En louage depuis Bab Alioua : 2h avec les arrêts.",distance,tunis,haouaria,el haouaria,km,durée,heure,trajet
Quelles spécialités culinaires goûter au Cap Bon ?,"**Poulpe grillé** à El Haouaria, **Thon rouge** mai-juin à Kélibia, **Brik à l'œuf** à Nabeul, **Harissa El Haouaria** (la plus forte du pays), **Muscat de Kélibia** (vin AOC), **Ojja aux fruits de mer**.",gastronomie,spécialités,manger,cuisine,local,goûter,plat,food,nourriture
Où manger du poisson frais à Kélibia ?,"**Restaurant El Mansourah** (tables pieds dans l'eau, fruits de mer ultra-frais, tél : +216 72 295 169), **Le Petit Pêcheur** (près du port, abordable, tél : +216 72 274 873), **Restaurant Le Pêcheur** (vue panoramique).",restaurant,manger,kelibia,kélibia,poisson,fruits de mer,adresse
Où manger à El Haouaria ?,"**Restaurant Les Grottes** (cuisine tunisienne authentique, mechouia maison, près des grottes romaines, ouvert avril-octobre). Gargotes autour du village : poulpe grillé, couscous poisson, grillades fraîches.",haouaria,el haouaria,restaurant,manger,adresse
Quel est le meilleur restaurant du Cap Bon ?,"**El Mansourah** (Kélibia) fruits de mer, **Dar Zitoun** (Nabeul) cuisine raffinée, **Le Petit Mousse** (Kélibia) ambiance port, **Les Grottes** (El Haouaria) authenticité. Réservation conseillée juillet-août.",meilleur,restaurant,top,recommandé,conseil
Qu'est-ce que le Muscat de Kélibia ?,"**Muscat de Kélibia** : vin blanc sec AOC, cépage muscat, robe dorée, arômes floraux et fruités. Idéal avec fruits de mer. Produit par les Vignobles de Carthage. Disponible dans les restaurants locaux.",muscat,vin,kelibia,kélibia,alcool,boisson,appellation
Quand a lieu le festival de fauconnerie d'El Haouaria ?,"**Festival International de la Fauconnerie** en **juin** à El Haouaria (3 jours, mi-juin). Démonstrations de vol libre, artisanat, musique traditionnelle. Entrée gratuite. L'événement le plus authentique du Cap Bon.",festival,fauconnerie,haouaria,juin,événement,dates,quand
Quels événements au Cap Bon ?,"**Calendrier** : Juin — Festival Fauconnerie El Haouaria. Juillet — Festival de Hammamet. Août — Fête de la Mer Kélibia & Nuits du Jasmin Nabeul. Octobre — Fête des Orangers Nabeul.",événements,festival,agenda,calendrier,animation,concerts
Météo au Cap Bon en été ?,"**Été (juin-août)** : 28-34°C, mer 24-26°C. Tramontane (nord-nord-ouest) l'après-midi. Sorties mer **avant 11h**. UV très élevés, crème SPF50+ indispensable.",météo,meteo,temps,été,ete,températures,climat,chaleur
Meilleure période pour visiter le Cap Bon ?,"**Mai-juin** (doux, peu de vent, mer calme, sans foule) et **septembre-octobre** (eau chaude 24°C, lumière magnifique). Éviter août (tramontane, chaleur, foule). Mai-juin idéal pour la plongée.",meilleur,période,quand venir,visiter,saison,recommandé
Fait-il froid en mer en hiver au Cap Bon ?,"Hiver (déc-mars) : eau 14-16°C, mer agitée. Navigation et baignade déconseillées sauf expérimentés. Bonne période pour randonnée terrestre, pêche et découverte des villages.",hiver,froid,décembre,janvier,mars,température,eau,mer
Qu'est-ce que la tramontane ?,"**Tramontane** : vent dominant du Cap Bon, nord-nord-ouest. Peut passer de 10 à 40 nœuds en 30 min, créant des creux de 2-3m. Se lève généralement après 11h en été.",tramontane,vent,nord,meteo,météo,mer agitée
Comment visiter les grottes d'El Haouaria ?,"Les **Grottes romaines** (Ghar el Kebir) se visitent depuis le village (5 min à pied). Taillées dans le calcaire par les Romains pour construire Carthage. Ouvertes tous les jours, guide local disponible.",grottes,haouaria,el haouaria,visiter,romaines,grotte,ghar el kebir
Où se trouve la forteresse de Kélibia ?,"**Forteresse de Kélibia** (Fort byzantin, VIe siècle) sur une colline dominant le port. Vue panoramique 360°. Accès à pied (20 min) ou voiture. Ouverte tous les jours, entrée symbolique.",forteresse,kelibia,kélibia,fort,byzantin,visiter,monument
Y a-t-il un ferry depuis Kélibia ?,"**Compagnie Tirrenia** : Kélibia → Trapani (Sicile, Italie) en saison (juin-sept). Traversée 6h. Réservation obligatoire à l'avance.",ferry,bateau,italie,trapani,sicile,kélibia,traversée,europe
Jerbi Events organise-t-il des sorties en mer ?,"Oui ! **Jerbi Events** propose sorties en mer, excursions nautiques, team building, mariages, événements. Site : **jerbievents.com**. Contacter via le bouton WhatsApp de l'application.",jerbi events,jerbi,agence,sorties,mer,organiser,réserver,contact
Comment contacter Jerbi Events ?,"**Jerbi Events** : site **jerbievents.com** ou via le bouton **WhatsApp** en bas de cette page. L'équipe organise sorties en mer, événements, team building, mariages et excursions au Cap Bon.",contact,contacter,jerbi,whatsapp,téléphone,réserver,info
Où se trouve Kerkouane ?,"**Kerkouane** : site archéologique punique classé **UNESCO**, entre El Haouaria et Kélibia (12 km de Kélibia). Seule cité punique entièrement préservée au monde. Musée sur place. Fermé le lundi.",kerkouane,punique,carthage,archéologie,UNESCO,patrimoine,musée,visiter
Peut-on faire du kitesurf au Cap Bon ?,"**Kitesurf** principalement à **Hammamet** (vent régulier en été). Spots aussi à Korba. École de kite à Hammamet avec location matériel. Tramontane favorable mais imprévisible.",kitesurf,kite,surf,wind,sport nautique,hammamet
Y a-t-il des dauphins au Cap Bon ?,"Dauphins communs et grands dauphins observés régulièrement au large, surtout **mars-avril** et automne. Sorties d'observation possibles via Jerbi Events selon conditions.",dauphins,dauphin,observation,mammifères marins
Où acheter de l'artisanat et poterie ?,"**Nabeul** : capitale tunisienne de la poterie. Grand souk le **vendredi matin**. Poterie, céramique, épices, huile d'olive AOP, harissa artisanale. Négociation habituelle au souk.",artisanat,poterie,céramique,nabeul,souk,shopping,acheter,boutique
Où trouver de la harissa au Cap Bon ?,"**Harissa d'El Haouaria** : la plus réputée de Tunisie — artisanale, très forte. Vente directe chez les producteurs et au marché du village. À Nabeul : Épicerie Terroir Cap Bon.",harissa,épices,produits locaux,terroir,acheter
Quels poissons pêcher au Cap Bon ?,"**Falaises nord** : bar, sar, pagre. **Fond sableux** : rouget, seiche, poulpe. **Au vif** : sériole, barracuda. **Mai-juin** : thon rouge (madrague active). Permis OMMP requis.",pêche,pêcher,poissons,bar,thon,daurade,pêcheur
Y a-t-il des oursins au Cap Bon ?,"Oursins abondants sur fonds rocheux, surtout en hiver. **Chaussons anti-oursins indispensables** sur les rochers. Piqûre : huile chaude ou épingle stérile pour retirer les épines.",oursin,piqûre,rochers,danger,sécurité,blessure
Y a-t-il des méduses au Cap Bon ?,"Juillet-août : **Pelagia noctiluca** (violette) et **Physalia physalis** (galère). Ne pas frotter la zone piquée. Rincer eau de mer, puis crème anti-brûlure. Généralement absent mai-juin.",méduse,méduses,piqûre,danger,été,brûlure
Peut-on voir des tortues marines au Cap Bon ?,"**Tortues Carette** observées en surface, particulièrement **juin-juillet** dans les herbiers (5-15m). Garder 50m de distance. Ne pas toucher ni nourrir.",tortue,tortues,carette,marine,observer,plongée
Quels hôtels au Cap Bon ?,"Hammamet : 4-5 étoiles (nombreux resorts). Kélibia : hôtels et maisons d'hôtes authentiques. Nabeul : milieu de gamme. El Haouaria : riads et maisons d'hôtes. **Dar Lina Charme et Nature** (El Haouaria) très apprécié.",hôtel,hébergement,dormir,logement,maison d'hôtes,riad,booking
Y a-t-il un hammam au Cap Bon ?,"**Spa Hammam El Kef** à Kélibia : gommage argile, savon beldi, cadre authentique. À Nabeul et Hammamet : nombreux spas et hammams dans les hôtels et en ville.",hammam,spa,bien-être,détente,massage,soin
Qu'est-ce que la posidonie ?,"**Posidonie** (Posidonia oceanica) : plante marine, poumon de la mer, produit 20L d'O2/h/m². **Strictement protégée** — ancrage et pose des pieds INTERDITS. Abrite daurades, sars, tortues.",posidonie,herbier,protection,écologie,méditerranée
Comment aller à Kerkouane ?,"Voiture depuis Kélibia (12 km, route côtière, 20 min) ou Nabeul (40 km). Pas de transport direct — taxi ou location de voiture depuis Kélibia conseillé.",kerkouane,accès,transport,route,voiture
Qu'est-ce que la madrague ?,"**Madrague** : filets fixes pour la pêche au thon rouge, active **mai-juin** autour d'El Haouaria. Bouées orange signalent la zone. **Navigation interdite** dans le périmètre.",madrague,thon,filets,navigation,interdiction,el haouaria,mai,juin
Y a-t-il un marché à Nabeul ?,"Grand **souk de Nabeul** le **vendredi matin** — le plus animé de la région. Poterie, céramique, épices, textiles. Parfums de jasmin et orangers en vente.",marché,souk,nabeul,vendredi,acheter,artisanat
Qu'est-ce que Ras Addar ?,"**Ras Addar** : pointe extrême du Cap Bon. Vue 360° sur la Méditerranée. Par temps clair, la Sicile visible (140 km). Accès piste (4x4 ou marche 45 min depuis El Haouaria).",ras addar,cap bon,pointe,bout,extrémité,vue,panorama
Randonnée au Cap Bon ?,"**Randonnée** : sentiers Korbous (sources thermales), mont Bou Kornine, Jebel Abderrahmane (637m, sommet du Cap Bon). Depuis El Haouaria : Ras Addar (45 min, vue panoramique).",randonnée,montagne,trail,marche,trekking,sport,nature
Où est Korbous ?,"**Korbous** : village thermal sur la côte ouest, 60 km de Tunis. Sources chaudes (60°C) qui coulent dans la mer — bain naturel unique ! Hammams traditionnels, promenade bord de mer.",korbous,thermal,bain,sources,spa naturel,côte,visiter
Qu'est-ce que le festival de Hammamet ?,"**Festival International de Hammamet** en **juillet**, théâtre de plein air du Centre Culturel. Concerts (arabe, jazz, classique), danse, théâtre. Une des plus grandes scènes d'Afrique du Nord.",hammamet,festival,théâtre,concert,musique,culture,juillet
Jerbi Explore fonctionne hors ligne ?,"Oui ! **PWA offline-first** : lieux, carte, partenaires, guide accessibles sans connexion après la première visite. Météo et événements nécessitent connexion pour mise à jour.",hors ligne,offline,pwa,app,connexion,internet,fonctionner
Comment installer Jerbi Explore ?,"**Chrome/Android** : bouton d'installation ou menu ⋮ → Ajouter à l'écran d'accueil. **iOS Safari** : bouton Partager → Ajouter à l'écran d'accueil. S'ouvre comme une app native.",installer,installation,télécharger,app,pwa,android,iphone,ios
Location de voiture au Cap Bon ?,"**Nabeul** et **Hammamet** : Avis, Hertz, Europcar, Sixt. Kélibia : agences locales. Recommandé pour El Haouaria et les sites isolés. Permis international conseillé pour étrangers.",voiture,location,louer,conduire,transport
Distributeurs automatiques au Cap Bon ?,"ATM dans tous les centres-villes. **El Haouaria** : 1 ATM au centre (vérifier disponibilité). Avoir du cash pour les petits villages et marchés.",distributeur,atm,argent,cash,banque,carte
La 4G au Cap Bon ?,"Bonne couverture 4G (Ooredoo, Orange TN, Telecom) à Hammamet, Nabeul, Kélibia. Zone de blanc possible : côte nord isolée et caps rocheux éloignés.",réseau,4g,internet,mobile,connexion,couverture
Langue parlée au Cap Bon ?,"**Arabe tunisien** (darija) + **français** très largement parlé. Les jeunes parlent souvent anglais. À Hammamet : anglais et allemand courants. Mots utiles : Marhba (bienvenue), Choukran (merci).",langue,arabe,français,parler,vocabulaire,tunisien
Monnaie au Cap Bon ?,"**Dinar tunisien (TND)**. Changer à l'aéroport ou banque. Cartes VISA/Mastercard dans hôtels et grands restaurants. Marchés et petits commerces : **cash uniquement**.",monnaie,dinar,euro,dollar,changer,paiement
Comment payer moins cher au Cap Bon ?,"**Louages** plutôt que taxis. **Gargotes locales** (2x moins cher). Marché du matin. Négociation au souk. **Éviter août** (prix +30%). Mai-juin et septembre : meilleur rapport qualité-prix.",budget,prix,économiser,pas cher,argent,coût
Règles de bienséance au Cap Bon ?,"Couvrir épaules et genoux dans les villages hors plage. Pendant le **Ramadan**, éviter de manger en public dans les zones rurales. Demander avant de photographier les personnes.",culture,respect,coutumes,religion,ramadan,tenue
Médicaments à emporter ?,"**Crème solaire SPF50+** (indispensable), crème anti-méduses, anti-histaminiques, antidiarrhéique, réhydratation orale. Pharmacies dans toutes les villes.",santé,médicaments,pharmacie,trousse de secours
Urgences médicales au Cap Bon ?,"**SAMU : 190**. Hôpital Nabeul : +216 72 285 011. Clinique Kélibia : +216 72 295 000. En mer : **VHF canal 16** (CROSS Tunis), Garde Nationale Maritime **187**.",urgences,secours,médecin,hôpital,samu,accidents,soins
Numéros d'urgence en Tunisie ?,"Police **197**, SAMU **190**, Pompiers **198**, Garde Nationale **187**. En mer : VHF canal 16, Garde Nationale Maritime **187**. Numéro européen **112** fonctionne aussi.",urgences,numéros,secours,police,pompiers,samu,appeler
Qu'est-ce que Jerbi Mer ?,"**Jerbi Mer** : PWA nautique de Jerbi Events. Profils sécurité (nageur, plongeur, apnéiste, pêcheur, plaisancier), guide faune/flore sous-marine Cap Bon, boussole, timer apnée, GPS, almanach maritime.",jerbi mer,mer,nautisme,plongée,application,pwa
Qu'est-ce que Jerbi Explore ?,"**Jerbi Explore** : application guide officielle du Cap Bon. Lieux, restaurants, partenaires, carte interactive, événements, météo, galerie photos, vidéos. Fonctionne hors ligne. Gratuit.",jerbi explore,application,guide,cap bon,présentation,c'est quoi
Jerbi Explore est-il gratuit ?,"**100% gratuit**, sans publicité, sans abonnement. Service offert par Jerbi Events pour promouvoir le tourisme au Cap Bon.",gratuit,prix,abonnement,payer,télécharger
Piscine naturelle au Cap Bon ?,"**Sources thermales de Korbous** (60°C dans la mer), **criques isolées** côte nord El Haouaria (eau cristalline), **lagune de Korba** (calme, peu profonde). Toutes gratuites et uniques !",piscine,naturelle,baignade,criques,source,eau,korbous
Peut-on camper au Cap Bon ?,"Bivouac toléré sur plages isolées. Terrains officiels à Hammamet. Maisons d'hôtes et riads authentiques à El Haouaria (moins chers que hôtels) recommandés.",camping,camper,tente,bivouac,nuit
Qu'est-ce que le garbis ?,"**Garbis** : vent chaud et sec du sud-ouest (Sahara). Fait monter la température de 10°C en quelques heures. Surtout mars-mai. Vérifier la météo marine avant toute sortie.",garbis,vent,sud,sahara,meteo,météo,conditions
Y a-t-il des requins en Méditerranée tunisienne ?,"Requins **extrêmement rares** en Méditerranée et pratiquement absents des côtes tunisiennes. Risque quasi nul. La vraie précaution : surveiller méduses et oursins.",requins,danger,mer,sécurité,peur
Peut-on faire du kayak au Cap Bon ?,"**Kayak de mer** : location à Hammamet et Kélibia en saison. Jerbi Events organise des sorties kayak autour des criques d'El Haouaria. Conditions idéales : vent < Beaufort 2.",kayak,sport,nautisme,location
Qu'est-ce que le cap Bon exactement ?,"**Cap Bon** (Ras Ettaïb) : péninsule au nord-est de la Tunisie, 70 km de long, 30 km de large. Nabeul, Hammamet, Korba, Kélibia, El Haouaria. Surnommée le 'jardin de la Tunisie'.",cap bon,péninsule,géographie,situation,définition
Y a-t-il des vols directs vers le Cap Bon ?,"**Tunis-Carthage** (pour Cap Bon Nord) ou **Enfidha-Hammamet** (liaisons directes Europe). Depuis Tunis-Carthage, 1h de voiture vers Nabeul. Depuis Enfidha, Hammamet à 30 min.",avion,vol,aéroport,arriver,international,europe
Histoire de Nabeul ?,"**Nabeul** (ancienne Neapolis) : fondée par les Grecs au Ve siècle av. J.-C. puis occupée par Rome. Célèbre depuis l'Antiquité pour ses potiers. Capitale artisanale de Tunisie.",histoire,nabeul,antiquité,grecs,romains,origine
Histoire d'El Haouaria ?,"**El Haouaria** (Aquilaria en latin) : point stratégique romain. Les grottes furent creusées par des esclaves pour extraire le calcaire servant à construire Carthage. Fauconnerie : tradition berbère millénaire classée UNESCO.",histoire,el haouaria,romains,carthage,fauconnerie,origine
Histoire de Kélibia ?,"**Kélibia** (Aspis/Clupea en grec/latin) : cité punique puis romaine. Forteresse byzantine du VIe siècle. Aujourd'hui port de pêche actif et point de départ vers l'Italie.",histoire,kelibia,kélibia,punique,byzantin,romain,port
Cuisine tunisienne : les incontournables ?,"Couscous, brik à l'œuf, ojja (ragout épicé), merguez, makloub (pain au thon), harissa. Omniprésence de l'huile d'olive, piments et cumin. L'harissa accompagne presque tout.",cuisine,tunisienne,plats,couscous,brik,gastronomie
Peut-on visiter une fabrique de poterie à Nabeul ?,"Nombreux **ateliers de poterie** accueillent les visiteurs à Nabeul. Démonstrations de tournage et décoration peinte à la main. Achat direct moins cher que les boutiques touristiques.",poterie,atelier,artisanat,nabeul,visiter,céramique
L'huile d'olive au Cap Bon ?,"**Huile d'olive AOP Nabeul** reconnue internationalement. Récolte octobre-novembre. Visite d'oliveraies et achat direct au producteur possible. Saveur fruitée, légèrement piquante.",huile d'olive,olivier,aop,nabeul,produit local
Quels fruits pousse au Cap Bon ?,"**Oranges** (déc-mars), citrons, mandarines, grenades, figues, raisins muscat. L'odeur des orangers en fleur (mars-avril) est le parfum signature. Marchés très abondants.",fruits,oranges,agrumes,figue,raisin,agriculture
Où faire du vélo au Cap Bon ?,"Route côtière **Kélibia → El Haouaria** (17 km, peu de circulation). Piste **Kerkouane → El Haouaria** (20 km, sites archéologiques). Location à Hammamet et Nabeul. Éviter les routes principales en été.",vélo,vtt,cyclisme,piste,sport,nature
Y a-t-il des coraux au Cap Bon ?,"**Gorgones** (coraux rouges et jaunes) sur tombants nord à partir de 20m. Fonds de 5-10m : éponges colorées et coraux branchus sur rochers ombragés d'El Haouaria. Strictement protégés.",coraux,gorgones,coral,reef,fonds,plongée
Quel est le coût de la vie pour un touriste au Cap Bon ?,"Budget journalier (2025) : **Économique** 30-50 TND. **Confort** 80-120 TND. **Confortable** 200+ TND. 1 EUR ≈ 3.4 TND. Le Cap Bon est très abordable pour les Européens.",coût,budget,prix,argent,dépenser,touriste
Où trouver du wifi gratuit au Cap Bon ?,"Wifi gratuit dans tous les hôtels, la majorité des cafés de Nabeul, Hammamet, Kélibia. Pour les zones isolées : SIM locale Ooredoo ou Orange TN (5 TND).",wifi,internet,connexion,gratuit
Activités de groupe au Cap Bon ?,"**Via Jerbi Events** : sorties en mer (10-50 personnes), team building kayak/voile, quiz culturel Cap Bon, soirées gastronomiques, olympiades sur plage, randonnée Ras Addar.",groupe,team building,excursion,activité,entreprise,séminaire
Équipement pour une semaine au Cap Bon ?,"**Checklist** : crème SPF50+, chaussons néoprène, masque+tuba, serviette microfibre, bonnet fluo, vêtements légers + couche chaude (soirs), chaussures de marche, cash.",équipement,valise,préparer,emporter,liste,checklist
La plage de Hammamet est-elle propre ?,"**Pavillon Bleu** plusieurs années consécutives. Eau analysée régulièrement, drapeaux de baignade, douches. Zone nord (Yasmine Hammamet) la plus propre.",hammamet,plage,propre,pavillon bleu,qualité
Y a-t-il une médina à Hammamet ?,"**Médina de Hammamet** : remparts XIIe siècle, ruelles blanches et bleues, boutiques artisanat. Accès libre. À visiter en soirée pour l'ambiance lumières.",médina,hammamet,remparts,vieille ville,historique,visiter
Peut-on voir des étoiles au Cap Bon ?,"Excellentes conditions astronomiques loin des lumières de Tunis. **Perséides** (12-13 août) spectaculaires à Ras Addar. Voie Lactée visible les nuits sans lune d'avril à octobre.",étoiles,astronomie,nuit,ciel,perséides
Prix d'un repas au Cap Bon ?,"Plat gargote : 5-8 TND. Restaurant vue mer : 20-40 TND. Café + brik : 3 TND. Poisson grillé port : 15-25 TND. Couscous poisson : 12-18 TND. 1 EUR ≈ 3.4 TND.",prix,repas,budget,TND,restaurant,combien
Peut-on manger halal au Cap Bon ?,"Quasi toute la restauration est naturellement **halal** (Tunisie 98% musulmane). Seuls les grands hôtels servent du porc. Vins disponibles dans hôtels et certains restaurants.",halal,islamique,nourriture,religion
Excursions journée depuis Tunis vers le Cap Bon ?,"Jerbi Events organise : Nabeul+Hammamet (8h-19h), El Haouaria+grottes (7h), Kélibia+Kerkouane+Mansoura (full day). Prix : 50-90 TND/personne transport inclus.",excursion,journée,tunis,day trip,organiser
Y a-t-il des flamants roses au Cap Bon ?,"**Flamants roses** hivernent à la lagune de Korba et zones humides côte est (octobre-mars). Quelques dizaines à centaines d'individus. Jumelles recommandées.",flamants,roses,oiseaux,observation,korba,hiver,nature
Peut-on voir des cigognes au Cap Bon ?,"**Cigognes blanches** migrent sur le Cap Bon en mars-avril (vers le nord) et août-sept (vers le sud). Ras Addar : point d'observation — jusqu'à 5000 cigognes/jour lors des pics.",cigognes,oiseaux,migration,ras addar,nature
Qu'est-ce que le bain maure ou hammam traditionnel ?,"**Hammam** tunisien : vestiaire → salle tiède → salle chaude. Savon beldi (huile d'olive), gommage à la kessa. Durée 1h-1h30. Prix 15-30 TND avec gommage. Hommes et femmes séparés.",hammam,bain maure,traditionnel,soin,gommage,culture
Faune sous-marine du Cap Bon ?,"**À observer** : murènes, poulpes, mérous, sars, daurades, girelles, étoiles de mer, oursins, anémones, gorgones. En saison : tortues Carette (juin-août), dauphins au large. Plancton bioluminescent (juillet-août).",faune,poissons,sous-marin,espèces,marine,biodiversité
Peut-on louer un voilier au Cap Bon ?,"Location à **Hammamet Marina** et **port de Kélibia** (avec ou sans skipper). Recommandé avec skipper local pour les premières sorties. Tarifs : 200-600 TND/journée.",voilier,charter,location,marina,plaisance,naviguer
Qu'est-ce que le plancton luminescent ?,"En **juillet-août**, nuits sans lune, le plancton bioluminescent illumine les vagues en bleu-vert. Dû aux dinoflagellés. Visible depuis plages peu éclairées de Kélibia et El Haouaria.",plancton,bioluminescent,lueur,nuit,mer,phosphorescence
Comment fonctionne un louage ?,"**Louage** : taxi collectif tunisien. Attend d'être plein (5-7 passagers) puis part. Prix fixé, très économique (Tunis–Nabeul : ~7 TND). Gare Tunis : Bab Alioua. Pas de réservation.",louage,taxi,transport,collectif,prix
Qu'est-ce que la cité punique de Kerkouane ?,"**Kerkouane** (IVe-IIIe siècle av. J.-C.) : ville punique jamais reconstruite après sa destruction par Rome. Rues, maisons avec salles de bain (premières égouts de l'Antiquité), ateliers de pourpre. Classée UNESCO 1986.",kerkouane,punique,histoire,archéologie,UNESCO,carthage
Qu'est-ce que le siwa ou eau de fleur d'oranger ?,"**Siwa** (eau de fleur d'oranger) : ingrédient emblématique de la pâtisserie tunisienne, produit à Nabeul lors de la floraison. Parfume makroudh, bklawa, ghraïba. Excellent souvenir.",siwa,eau de fleur,oranger,pâtisserie,nabeul,parfum
Sécurité en Tunisie ?,"Tunisie globalement **sûre pour les touristes**. Le Cap Bon est l'une des régions les plus sécurisées. Précautions normales : éviter de montrer des objets de valeur. Consulter les conseils du Ministère des AE de votre pays.",sécurité,sûreté,danger,tunisie,risque,voyager
